com,n_com,dgr_int,PY,TI,AU,UT,seed_com
1,22,0.6247339526750265,2018,SLOWING DOWN INTERACTIONS ON TANGIBLE TABLETOP INTERFACES: A COMPARATIVE USER STUDY IN THE CONTEXT OF COLLABORATIVE PROBLEM SOLVING,LAHURE C;MAQUIL V,2-S2.0-85061187882,TRUE
1,22,0.5116175717809112,2016,HAND GESTURES DURING COLLABORATIVE PROBLEM SOLVING,DIMITRA A;FAL M;RAS E,2-S2.0-84979759178,TRUE
1,22,0.5001978807318074,2017,CASE STUDY ANALYSIS ON COLLABORATIVE PROBLEM SOLVING USING A TANGIBLE INTERFACE,ANASTASIOU D;RAS E,2-S2.0-85019685317,TRUE
1,22,0.45863423932389447,2016,DESIGN IMPLICATIONS FOR A USER STUDY ON A TANGIBLE TABLETOP,ANASTASIOU D;MAQUIL V;RAS E;FAL M,2-S2.0-84985990858,TRUE
1,22,0.4116938628220538,2021,BALANCING SHAREABILITY AND POSITIVE INTERDEPENDENCE TO SUPPORT COLLABORATIVE PROBLEM-SOLVING ON INTERACTIVE TABLETOPS,MAQUIL V;AFKARI H;AREND B;HEUSER S;SUNNEN P,2-S2.0-85105331895,TRUE
2,20,0.6378717840657755,2018,ENTERPRISE MODELLING IN THE AGE OF DIGITAL TRANSFORMATION,VAN GILS B;PROPER HA,2-S2.0-85056480141,TRUE
2,20,0.6324451614115563,2019,TOWARDS A MULTI-STAGE STRATEGY TO TEACH ENTERPRISE MODELLING,PROPER HA;BJEKOVIĆ M;VAN GILS B;HOPPENBROUWERS SJBA,2-S2.0-85059878571,TRUE
2,20,0.5792419345108486,2018,TOWARDS GROUNDED ENTERPRISE MODELLING,PROPER HA;BJEKOVIĆ M;VAN GILS B;HOPPENBROUWERS SJBA,2-S2.0-85045332491,TRUE
2,20,0.5631290272431849,2021,ON DOMAIN CONCEPTUALIZATION,PROPER HA;GUIZZARDI G,2-S2.0-85105927985,TRUE
2,20,0.4997351885451252,2020,ON DOMAIN MODELLING AND REQUISITE VARIETY: CURRENT STATE OF AN ONGOING JOURNEY,PROPER HA;GUIZZARDI G,2-S2.0-85097085239,TRUE
3,16,0.673335235433484,2020,A SEMI-AUTOMATED SYSTEM FOR INTEROPERABILITY ASSESSMENT: AN ONTOLOGY-BASED APPROACH,DA SILVA SERAPIÃO LEAL G;GUÉDRIA W;PANETTO H,2-S2.0-85076491483,TRUE
3,16,0.599220517865065,2019,AN ONTOLOGY FOR INTEROPERABILITY ASSESSMENT: A SYSTEMIC APPROACH,DA SILVA SERAPIÃO LEAL G;GUÉDRIA W;PANETTO H,2-S2.0-85070228513,TRUE
3,16,0.5353351356479601,2020,TOWARDS SMART ASSESSMENT: A METAMODEL PROPOSAL,ROMERO M;GUÉDRIA W;PANETTO H;BARAFORT B,2-S2.0-85081175171,TRUE
3,16,0.4670210405866143,2020,TOWARDS A CONCEPTUAL FRAMEWORK FOR SMART ASSESSMENT IN ORGANISATIONS,ROMERO M;GUÉDRIA W;PANETTO H;BARAFORT B,2-S2.0-85107791993,TRUE
3,16,0.43998253557466244,2019,INTEROPERABILITY ASSESSMENT: A SYSTEMATIC LITERATURE REVIEW,DA SILVA SERAPIÃO LEAL G;GUÉDRIA W;PANETTO H,2-S2.0-85060169989,TRUE
4,13,2.002717263138036,2019,A HYBRID EVOLUTIONARY ALGORITHM FOR SMART FREIGHT DELIVERY WITH ELECTRIC MODULAR VEHICLES,REZGUI D;BOUZIRI H;AGGOUNE-MTALAA W;SIALA JC,2-S2.0-85061921125,TRUE
4,13,1.8466737817424277,2019,AN EVOLUTIONARY VARIABLE NEIGHBORHOOD DESCENT FOR ADDRESSING AN ELECTRIC VRP VARIANT,REZGUI D;BOUZIRI H;AGGOUNE-MTALAA W;SIALA JC,2-S2.0-85064052521,TRUE
4,13,1.8136543529416638,2019,AN ENHANCED EVOLUTIONARY METHOD FOR ROUTING A FLEET OF ELECTRIC MODULAR VEHICLES,REZGUI D;AGGOUNE-MTALAA W;BOUZIRI H;CHAOUACHI-SIALA J,2-S2.0-85074927340,TRUE
4,13,1.5233061992409016,2019,A MEMETIC ALGORITHM FOR FLEET SIZE AND MIX VEHICLE ROUTING PROBLEMS WITH ELECTRIC MODULAR VEHICLES,REZGUI D;SIALA JC;AGGOUNE-MTALAA W;BOUZIRI H,2-S2.0-85069826540,TRUE
4,13,1.3352318069796987,2018,TOWARDS SMART URBAN FREIGHT DISTRIBUTION USING FLEETS OF MODULAR ELECTRIC VEHICLES,REZGUI D;SIALA JC;AGGOUNE-MTALAA W;BOUZIRI H,2-S2.0-85061896016,TRUE
5,9,0.3716240061744942,2018,A SOFTWARE ARTEFACT TO SUPPORT STANDARD-BASED PROCESS ASSESSMENT: EVOLUTION OF THE TIPA® FRAMEWORK IN A DESIGN SCIENCE RESEARCH PROJECT,BARAFORT B;SHRESTHA A;CORTINA S;RENAULT A,2-S2.0-85048544202,TRUE
5,9,0.35403010830225257,2017,THE EVOLUTION OF THE TIPA FRAMEWORK: TOWARDS THE AUTOMATION OF THE ASSESSMENT PROCESS IN A DESIGN SCIENCE RESEARCH PROJECT,BARAFORT B;SHRESTHA A;CORTINA S,2-S2.0-85029741720,TRUE
5,9,0.3093790651236687,2017,HOW TO ELICIT PROCESSES FOR AN ISO-BASED INTEGRATED RISK MANAGEMENT PROCESS REFERENCE MODEL IN IT SETTINGS?,BARAFORT B;MESQUIDA A-L;MAS A,2-S2.0-85030637582,TRUE
5,9,0.23871768860963055,2018,INTEGRATED RISK MANAGEMENT PROCESS ASSESSMENT MODEL FOR IT ORGANIZATIONS BASED ON ISO 31000 IN AN ISO MULTI-STANDARDS CONTEXT,BARAFORT B;MESQUIDA A-L;MAS A,2-S2.0-85049092022,TRUE
5,9,0.23253594258936655,2017,DEVELOPING AN INTEGRATED RISK MANAGEMENT PROCESS MODEL FOR IT SETTINGS IN AN ISO MULTI-STANDARDS CONTEXT,BARAFORT B;MESQUIDA A-L;MAS A,2-S2.0-85029759833,TRUE
6,9,0.3100735346612408,2017,EVALUATION OF THE RISK AND SECURITY OVERLAY OF ARCHIMATE TO MODEL INFORMATION SYSTEM SECURITY RISKS,MAYER N;FELTUS C,2-S2.0-85043570014,TRUE
6,9,0.2562287020406886,2019,AN INTEGRATED CONCEPTUAL MODEL FOR INFORMATION SYSTEM SECURITY RISK MANAGEMENT SUPPORTED BY ENTERPRISE ARCHITECTURE MANAGEMENT,MAYER N;AUBERT J;GRANDRY E;FELTUS C;GOETTELMANN E;WIERINGA R,2-S2.0-85041900629,TRUE
6,9,0.18521828498509604,2018,A RISK INTEGRATION FRAMEWORK FOR THE SERVICE-ORIENTED ENTERPRISE,GRANDRY E;FELTUS C;DUBOIS E,2-S2.0-85048439117,TRUE
6,9,0.13664596273291924,2017,AN APPROACH FOR TRANSFORMING IT-NETWORK DIAGRAMS INTO ENTERPRISE ARCHITECTURE MODELS,MACIEJEWSKI D;MAYER N,2-S2.0-85032887406,TRUE
6,9,0.13382047697716778,2016,TOWARDS A SYSTEMIC APPROACH FOR INFORMATION SECURITY RISK MANAGEMENT,"NAUDET Y;MAYER N;FELTUS C",2-S2.0-85015260587,TRUE
7,8,1.4123366885732136,2018,VALUE COCREATION (VCC) LANGUAGE DESIGN IN THE FRAME OF A SMART AIRPORT NETWORK CASE STUDY,FELTUS C;PROPER EHA;METZGER A;GARCIA LOPEZ JC;GONZALEZ CASTINEIRA R,2-S2.0-85052310138,FALSE
7,8,1.2965181786153213,2017,CONCEPTUALIZATION OF AN ABSTRACT LANGUAGE TO SUPPORT VALUE CO-CREATION,FELTUS C;PROPER EHA,2-S2.0-85039904167,FALSE
7,8,1.2790768162491009,2018,TOWARDS A LANGUAGE TO SUPPORT VALUE COCREATION: AN EXTENSION TO THE ARCHIMATE MODELING FRAMEWORK,FELTUS C;PROPER EH;HAKI K,2-S2.0-85057223127,FALSE
7,8,1.278723581801969,2018,CONCEPTUALIZATION OF A VALUE COCREATION LANGUAGE FOR KNOWLEDGE-INTENSIVE BUSINESS SERVICES,FELTUS C;LESSARD L;VERNADAT F;AMYOT D;PROPER EHA,2-S2.0-85044461460,FALSE
7,8,1.164227932508034,2019,DERIVING INFORMATION SYSTEM SECURITY AND PRIVACY FROM VALUE COCREATION THEORY: CASE STUDY IN THE FINANCIAL SECTOR,FELTUS C,2-S2.0-85094139498,FALSE
8,7,0.11602707978101728,2017,A TAXONOMY OF VISUALIZATION TASKS FOR THE ANALYSIS OF BIOLOGICAL PATHWAY DATA,MURRAY P;MCGEE F;FORBES AG,2-S2.0-85013784258,FALSE
8,7,0.10918976408202094,2019,THE STATE OF THE ART IN MULTILAYER NETWORK VISUALIZATION,MCGEE F;GHONIEM M;MELANÇON G;OTJACQUES B;PINAUD B,2-S2.0-85063638574,FALSE
8,7,0.10768371400198609,2019,M-QUBE3: QUERYING BIG MULTILAYER GRAPH BY EVOLUTIVE EXTRACTION AND EXPLORATION,LAUMOND A;MELANCON G;PINAUD B;GHONIEM M,2-S2.0-85080100256,FALSE
8,7,0.08046407185628743,2020,A METHODOLOGY FOR MULTILAYER NETWORKS ANALYSIS IN THE CONTEXT OF OPEN AND PRIVATE DATA: BIOLOGICAL APPLICATION,MALEK M;ZORZAN S;GHONIEM M,2-S2.0-85088476049,FALSE
8,7,0.06602606339079509,2017,CROWDSOURCING FOR INFORMATION VISUALIZATION: PROMISES AND PITFALLS,BORGO R;LEE B;BACH B;FABRIKANT S;JIANU R;KERREN A;KOBOUROV S;MCGEE F;MICALLEF L;VON LANDESBERGER T;BALLWEG K;DIEHL S;SIMONETTO P;ZHOU M,2-S2.0-85031501419,FALSE
9,6,0.25876940770557794,2017,FIRST WORKSHOP ON TRUST IN THE AGE OF AUTOMATED DRIVING,NOAH BE;WINTERSBERGER P;MIRNIG AG;THAKKAR S;YAN F;GABLE TM;KRAUS J;MCCALL R,2-S2.0-85034815611,FALSE
9,6,0.21621621621621623,2018,SECOND WORKSHOP ON TRUST IN THE AGE OF AUTOMATED DRIVING,WINTERSBERGER P;NOAH BE;KRAUS J;MCCALL R;MIRNIG AG;KUNZE A;THAKKAR S;WALKER BN,2-S2.0-85063154471,FALSE
9,6,0.13262502289796665,2016,TOWARDS A TAXONOMY OF AUTONOMOUS VEHICLE HANDOVER SITUATIONS,MCCALL R;MCGEE F;MESCHTSCHERJAKOV A;LOUVETON N;ENGEL T,2-S2.0-85012034014,FALSE
9,6,0.11320754716981132,2019,A TAXONOMY OF AUTONOMOUS VEHICLE HANDOVER SITUATIONS,MCCALL R;MCGEE F;MIRNIG A;MESCHTSCHERJAKOV A;LOUVETON N;ENGEL T;TSCHELIGI M,2-S2.0-85048283024,FALSE
9,6,0.07413213885778275,2017,WHAT WE CAN LEARN FROM PILOTS FOR HANDOVERS AND (DE)SKILLING IN SEMI-AUTONOMOUS DRIVING: AN INTERVIEW STUDY,TRÖSTERER S;MESCHTSCHERJAKOV A;MIRNIG AG;LUPP A;GÄRTNER M;MCGEE F;MCCALL R;TSCHELIGI M;ENGEL T,2-S2.0-85032509818,FALSE
10,5,0.2034115601912212,2020,A NEW PARADIGM AND META-MODEL FOR CYBER-PHYSICAL-SOCIAL SYSTEMS,BEREKET ABERA Y;NAUDET Y;PANETTO H,2-S2.0-85103977534,FALSE
10,5,0.19659682320407043,2021,SYSTEMIC FORMALISATION OF CYBER-PHYSICAL-SOCIAL SYSTEM (CPSS): A SYSTEMATIC LITERATURE REVIEW,YILMA BA;PANETTO H;NAUDET Y,2-S2.0-85103932096,FALSE
10,5,0.14279398762157383,2019,A META-MODEL OF CYBER-PHYSICAL-SOCIAL SYSTEM: THE CPSS PARADIGM TO SUPPORT HUMAN-MACHINE COLLABORATION IN INDUSTRY 4.0,YILMA BA;PANETTO H;NAUDET Y,2-S2.0-85072980781,FALSE
10,5,0.12142857142857143,2021,TOWARDS A PERSONALISATION FRAMEWORK FOR CYBER-PHYSICAL-SOCIAL SYSTEM (CPSS),YILMA BA;NAUDET Y;PANETTO H,2-S2.0-85120698487,FALSE
10,5,0.03409090909090909,2019,INTRODUCTION TO PERSONALISATION IN CYBER-PHYSICAL-SOCIAL SYSTEMS,YILMA BA;NAUDET Y;PANETTO H,2-S2.0-85062297578,FALSE
11,5,0.15420591456736035,2017,PRIVACY-PRESERVING HYBRID RECOMMENDER SYSTEM,TANG Q;WANG H,2-S2.0-85022209554,FALSE
11,5,0.13357142857142856,2017,DIFFERENTIALLY PRIVATE NEIGHBORHOOD-BASED RECOMMENDER SYSTEMS,WANG J;TANG Q,2-S2.0-85019761581,FALSE
11,5,0.07716385410996189,2018,EFFICIENT HOMOMORPHIC INTEGER POLYNOMIAL EVALUATION BASED ON GSW FHE,WANG H;TANG Q,2-S2.0-85045456245,FALSE
11,5,0.05357142857142857,2019,NOVEL COLLABORATIVE FILTERING RECOMMENDER FRIENDLY TO PRIVACY PROTECTION,WANG J;TANG Q;ARRIAGA A;RYAN PYA,2-S2.0-85074948269,FALSE
11,5,0.015006132313685881,2021,POST-QUANTUM ERA PRIVACY PROTECTION FOR INTELLIGENT INFRASTRUCTURES,MALINA L;DZURENDA P;RICCI S;HAJNY J;SRIVASTAVA G;MATULEVICIUS R;AFFIA A-AO;LAURENT M;SULTAN NH;TANG Q,2-S2.0-85101745440,FALSE
12,5,0.6297527706734869,2018,EVOLVING SEMANTIC ANNOTATIONS THROUGH MULTIPLE VERSIONS OF CONTROLLED MEDICAL TERMINOLOGIES,CARDOSO S;REYNAUD-DELAÎTRE C;DA SILVEIRA M;LIN Y-C;GROß A;RAHM E;PRUSKI C,2-S2.0-85055046245,FALSE
12,5,0.5559714795008913,2017,TOWARDS A MULTI-LEVEL APPROACH FOR THE MAINTENANCE OF SEMANTIC ANNOTATIONS,CARDOSO SD;REYNAUD-DELAÎTRE C;SILVEIRA MD;LIN Y-C;GROß A;RAHM E;PRUSKI C,2-S2.0-85051741217,FALSE
12,5,0.3444025157232704,2017,AUTOMATIC MAINTENANCE OF SEMANTIC ANNOTATIONS,CARDOSO SD,2-S2.0-85019673205,FALSE
12,5,0.16048094709581945,2019,COMBINING SEMANTIC AND LEXICAL MEASURES TO EVALUATE MEDICAL TERMS SIMILARITY,CARDOSO SD;DA SILVEIRA M;LIN Y-C;CHRISTEN V;RAHM E;REYNAUD-DELAÎTRE C;PRUSKI C,2-S2.0-85059696120,FALSE
12,5,0.10925366193908394,2020,CONSTRUCTION AND EXPLOITATION OF AN HISTORICAL KNOWLEDGE GRAPH TO DEAL WITH THE EVOLUTION OF ONTOLOGIES,CARDOSO SD;DA SILVEIRA M;PRUSKI C,2-S2.0-85078000451,FALSE
13,5,0.14722222222222223,2019,COMPARING STAKEHOLDER INCENTIVES ACROSS STATE-OF-THE-ART RENEWABLE SUPPORT MECHANISMS,MIHAYLOV M;RĂDULESCU R;RAZO-ZAPATA I;JURADO S;ARCO L;AVELLANA N;NOWÉ A,2-S2.0-85050454137,FALSE
13,5,0.1204780361757106,2018,NRGCOIN-A BLOCKCHAIN-BASED REWARD MECHANISM FOR BOTH PRODUCTION AND CONSUMPTION OF RENEWABLE ENERGY,MIHAYLOV M;RAZO-ZAPATA I;NOWÉ A,2-S2.0-85081561216,FALSE
13,5,0.058970099667774084,2018,MODELING IN SUPPORT OF MULTI-PERSPECTIVE VALUATION OF SMART GRID INITIATIVES,KACZMAREK-HEß M;DE KINDEREN S;MA Q;RAZO-ZAPATA IS,2-S2.0-85050856783,FALSE
13,5,0.05,2017,ANALYSING THE IMPACT OF STORAGE AND LOAD SHIFTING ON GREY ENERGY DEMAND REDUCTION,RAZO-ZAPATA IS;MIHAYLOV M;NOWÉ A,2-S2.0-85028379324,FALSE
13,5,0.03571428571428571,2017,THE CONJOINT MODELING OF VALUE NETWORKS AND REGULATIONS OF SMART GRID PLATFORMS: A LUXEMBOURG CASE STUDY,RAZO-ZAPATA IS;MA Q;KACZMAREK-HEB M,2-S2.0-85029460088,FALSE
14,4,0.338572695035461,2019,BLOCKCHAIN: ANALYSIS OF THE NEW TECHNOLOGICAL COMPONENTS AS OPPORTUNITY TO SOLVE THE TRUST ISSUES IN SUPPLY CHAIN MANAGEMENT,IMERI A;AGOULMINE N;FELTUS C;KHADRAOUI D,2-S2.0-85069512895,FALSE
14,4,0.2380009896091044,2018,SOLVING THE TRUST ISSUES IN THE PROCESS OF TRANSPORTATION OF DANGEROUS GOODS BY USING BLOCKCHAIN TECHNOLOGY,IMERI A;FELTUS C;KHADRAOUI D;AGOULMINE N;NICOLAS D,2-S2.0-85056733283,FALSE
14,4,0.15341638981173866,2020,MODEL OF DYNAMIC SMART CONTRACT FOR PERMISSIONED BLOCKCHAINS,IMERI A;LAMONT J;AGOULMINE N;KHADRAOUI D,2-S2.0-85083036091,FALSE
14,4,0.14732142857142858,2018,THE SECURITY AND TRACEABILITY OF SHARED INFORMATION IN THE PROCESS OF TRANSPORTATION OF DANGEROUS GOODS,IMERI A;KHADRAOUI D,2-S2.0-85051005438,FALSE
15,3,0.0697608469609604,2020,TOWARDS A SEMANTIC CONSTRUCTION DIGITAL TWIN: DIRECTIONS FOR FUTURE RESEARCH,BOJE C;GUERRIERO A;KUBICKI S;REZGUI Y,2-S2.0-85082386834,FALSE
15,3,0.056338028169014086,2021,A 4D BIM SYSTEM ARCHITECTURE FOR THE SEMANTIC WEB,BOJE C;KUBICKI S;GUERRIERO A,2-S2.0-85088466323,FALSE
15,3,0.013422818791946308,2020,AN INTELLIGENT SEMANTIC SYSTEM FOR REAL-TIME DEMAND RESPONSE MANAGEMENT OF A THERMAL GRID,LI Y;REZGUI Y;KUBICKI S,2-S2.0-85072665107,FALSE
16,3,0.15695402298850575,2019,USING SOCIAL MEDIA TO LEVERAGE AND DEVELOP DYNAMIC CAPABILITIES FOR INNOVATION,MENTION A-L;BARLATIER P-J;JOSSERAND E,2-S2.0-85063272253,FALSE
16,3,0.13597918022121014,2020,HOW SOCIAL MEDIA CAN FUEL INNOVATION IN BUSINESSES: A STRATEGIC ROADMAP,BARLATIER P-J;MENTION A-L,2-S2.0-85062663008,FALSE
16,3,0.1090251572327044,2019,SOCIAL MEDIA AND INNOVATION: A SYSTEMATIC LITERATURE REVIEW AND FUTURE RESEARCH DIRECTIONS,BHIMANI H;MENTION A-L;BARLATIER P-J,2-S2.0-85054805165,FALSE
17,3,1.2525252525252526,2017,"MAESTRO: TOWARDS A COLLABORATIVE AAL MARKET QUALITY ASSURANCE PLATFORM FOR MONITORING DEVICES, SYSTEMS AND SERVICES",COAN K;AGGOUNE-MTALAA W;BOND R;KHADRAOUI D,2-S2.0-85048696435,FALSE
17,3,1.222222222222222,2018,"DISCUSSING AN ECONOMIC PERSPECTIVE FOR MAESTRO, AN ASSESSMENT PLATFORM FOR AMBIENT ASSISTED LIVING PRODUCTS",COAN K;AGGOUNE-MTALAA W;BOND R;KHADRAOUI D,2-S2.0-85057371368,FALSE
17,3,0.696969696969697,2017,MAESTRO: CONSTRUCTING A REFERENCE FRAMEWORK FOR SELF MONITORING DEVICES DEDICATED TO SENIORS,OUEDRAGO M;AGGOUNE-MTALAA W;KHADRAOUI D,2-S2.0-85045837438,FALSE
18,3,0.56,2016,BIG DATA CLUSTERING USING DATA STREAMS APPROACH,LOUHI I;BOUDJELOUD-ASSALA L;TAMISIER T,2-S2.0-85015057814,FALSE
18,3,0.5384615384615384,2016,INCREMENTAL NEAREST NEIGHBORHOOD GRAPH FOR DATA STREAM CLUSTERING,LOUHI I;BOUDJELOUD-ASSALA L;TAMISIER T,2-S2.0-85007246761,FALSE
18,3,0.09846153846153846,2017,SUBSPACE CLUSTERING AND VISUALIZATION OF DATA STREAMS,LOUHI I;BOUDJELOUD-ASSALA L;TAMISIER T,2-S2.0-85047923301,FALSE
19,2,0.20930232558139536,2021,TIRE SURFACE SEGMENTATION IN INFRARED IMAGING WITH CONVOLUTIONAL NEURAL NETWORKS AND TRANSFER LEARNING,"NAVA R;FEHR D;PETRY F;TAMISIER T",2-S2.0-85115248829,FALSE
19,2,0.20930232558139536,2021,TIRE SURFACE SEGMENTATION IN INFRARED IMAGING WITH CONVOLUTIONAL NEURAL NETWORKS,"NAVA R;FEHR D;PETRY F;TAMISIER T",2-S2.0-85104289304,FALSE
20,2,0.125,2020,ADVANCED ANALYSIS OF TEMPORAL DATA USING FISHER-SHANNON INFORMATION: THEORETICAL DEVELOPMENT AND APPLICATION IN GEOSCIENCES,GUIGNARD F;LAIB M;AMATO F;KANEVSKI M,2-S2.0-85088785308,FALSE
20,2,0.125,2020,ANALYSIS OF AIR POLLUTION TIME SERIES USING COMPLEXITY-INVARIANT DISTANCE AND INFORMATION MEASURES,AMATO F;LAIB M;GUIGNARD F;KANEVSKI M,2-S2.0-85081345649,FALSE
21,2,0.17647058823529413,2020,PROMOTING ENERGY EFFICIENCY IN THE BUILT ENVIRONMENT THROUGH ADAPTED BIM TRAINING AND EDUCATION,ALHAMAMI A;PETRI I;REZGUI Y;KUBICKI S,2-S2.0-85084302629,FALSE
21,2,0.17647058823529413,2018,A VIRTUAL COLLABORATIVE PLATFORM TO SUPPORT BUILDING INFORMATION MODELING IMPLEMENTATION FOR ENERGY EFFICIENCY,PETRI I;ALHAMAMI A;REZGUI Y;KUBICKI S,2-S2.0-85053813991,FALSE
22,2,0.075,2019,RADIATION EXPOSURE FROM PEDIATRIC CT SCANS AND SUBSEQUENT CANCER RISK IN THE NETHERLANDS,MEULEPAS JM;RONCKERS CM;SMETS AMJB;NIEVELSTEIN RAJ;GRADOWSKA P;LEE C;JAHNEN A;VAN STRATEN M;DE WIT M-CY;ZONNENBERG B;KLEIN WM;MERKS JH;VISSER O;VAN LEEUWEN FE;HAUPTMANN M,2-S2.0-85059842135,FALSE
22,2,0.075,2018,"INDIVIDUAL RADIATION EXPOSURE FROM COMPUTED TOMOGRAPHY: A SURVEY OF PAEDIATRIC PRACTICE IN FRENCH UNIVERSITY HOSPITALS, 2010–2013",JOURNY NMY;DREUIL S;BODDAERT N;CHATEIL J-F;DEFEZ D;DUCOU-LE-POINTE H;GARCIER J-M;GUERSEN J;HABIB GERYES B;JAHNEN A;LEE C;PAYEN-DE-LA-GARANDERIE J;PRACROS J-P;SIRINELLI D;THIERRY-CHEF I;BERNIER M-O,2-S2.0-85028015371,FALSE
23,2,0.15625,2019,A LEARNING-BASED APPROACH TO COMBINE MEDICAL ANNOTATION RESULTS: (SHORT PAPER),CHRISTEN V;LIN Y-C;GROß A;CARDOSO SD;PRUSKI C;DA SILVEIRA M;RAHM E,2-S2.0-85059678980,FALSE
23,2,0.15625,2017,EVALUATING AND IMPROVING ANNOTATION TOOLS FOR MEDICAL FORMS,LIN Y-C;CHRISTEN V;GROß A;CARDOSO SD;PRUSKI C;DA SILVEIRA M;RAHM E,2-S2.0-85034218254,FALSE
24,2,0.16666666666666666,2018,A DESIGN-TIME SEMI-AUTOMATIC APPROACH FOR OBFUSCATING A BUSINESS PROCESS MODEL IN A TRUSTED MULTI-CLOUD DEPLOYMENT: A DESIGN-TIME APPROACH FOR BP OBFUSCATION,"NACER AA;GOETTELMANN E;YOUCEF S;TARI A;GODART C",2-S2.0-85053229334,FALSE
24,2,0.16666666666666666,2016,OBFUSCATING A BUSINESS PROCESS BY SPLITTING ITS LOGIC WITH FAKE FRAGMENTS FOR SECURING A MULTI-CLOUD DEPLOYMENT,"NACER AA;GOETTELMANN E;YOUCEF S;TARI A;GODART C",2-S2.0-84988856990,FALSE
25,2,0.07428571428571429,2018,BUSINESS MODELS AND TARIFF SIMULATION IN CAR-SHARING SERVICES,PERBOLI G;FERRERO F;MUSSO S;VESCO A,2-S2.0-85030669439,FALSE
25,2,0.07428571428571429,2018,CAR-SHARING SERVICES: AN ANNOTATED REVIEW,FERRERO F;PERBOLI G;ROSANO M;VESCO A,2-S2.0-85038035266,FALSE
26,2,0.10344827586206896,2017,TESTING A COMMERCIAL BCI DEVICE FOR IN-VEHICLE INTERFACES EVALUATION: A SIMULATOR AND REAL-WORLD DRIVING STUDY,LOUVETON N;SENGUPTA K;MCCALL R;FRANK R;ENGEL T,2-S2.0-85028722701,FALSE
26,2,0.10344827586206896,2016,DRIVING WHILE USING A SMARTPHONE-BASED MOBILITY APPLICATION: EVALUATING THE IMPACT OF THREE MULTI-CHOICE USER INTERFACES ON VISUAL-MANUAL DISTRACTION,LOUVETON N;MCCALL R;KOENIG V;AVANESOV T;ENGEL T,2-S2.0-84958035800,FALSE
27,2,0.08374384236453201,2017,CHARACTERISATION OF DOMESTIC HOT WATER END-USES FOR INTEGRATED URBAN THERMAL ENERGY ASSESSMENT AND OPTIMISATION,BERTRAND A;MASTRUCCI A;SCHÜLER N;AGGOUNE R;MARÉCHAL F,2-S2.0-84960145616,FALSE
27,2,0.08374384236453201,2017,IN-BUILDING WASTE WATER HEAT RECOVERY: AN URBAN-SCALE METHOD FOR THE CHARACTERISATION OF WATER STREAMS AND THE ASSESSMENT OF ENERGY SAVINGS AND COSTS,BERTRAND A;AGGOUNE R;MARÉCHAL F,2-S2.0-85012088608,FALSE
28,1,0,2018,AN ASSESSMENT FRAMEWORK TO SUPPORT COLLECTIVE DECISION MAKING ON URBAN FREIGHT TRANSPORT,GOLINI R;GUERLAIN C;LAGORIO A;PINTO R,2-S2.0-85050959479,FALSE
